{
  "description": "Cross-language conformance cases. Each case runs the real Claude or Codex runtime in both packages: offline against a local mock API that answers with `mock` steps and records requests, and live (opt-in, billed) when the case has a `live` section. Format: docs/fixtures/CONFORMANCE.md.",
  "version": 1,
  "coverage_exemptions": {
    "python": {},
    "typescript": {
      "anthropic:systemPrompt": "Claude takes it as options.systemPrompt; codex.system_prompt covers the reserved top-level name",
      "anthropic:maxTurns": "Claude takes it as options.maxTurns; codex.max_turns covers the reserved top-level name",
      "anthropic:permissionMode": "Claude takes it as options.permissionMode; codex.permission_mode covers the reserved top-level name",
      "anthropic:builtinTools": "Claude takes it as options.tools; codex.builtin_tools covers the reserved top-level name",
      "anthropic:timeout": "Python's timeout maps to signal; TypeScript reserves the name",
      "codex:timeout": "Python's timeout maps to signal; TypeScript reserves the name",
      "codex:client.baseUrl": "Selects the built-in provider, whose websocket transport and retries the mock cannot turn off; cases select a custom provider in CODEX_HOME/config.toml",
      "codex:client.codexPathOverride": "Runtime location; codex-exec.test.ts drives a fake runtime through it",
      "codex:thread.skipGitRepoCheck": "The runner sets it for every case because scratch directories are not repositories",
      "codex:thread.additionalDirectories": "No Python counterpart; it only adds writable sandbox roots"
    }
  },
  "cases": [
    {
      "id": "anthropic.basic",
      "provider": "anthropic",
      "options": { "model": "claude-haiku-4-5" },
      "prompt": "Reply with the single word PONG.",
      "mock": [{ "text": "PONG" }],
      "expect": {
        "status": "success",
        "final_text": "PONG",
        "events": { "includes": ["run_started", "session_info", "text", "usage", "run_finished"] },
        "requests": {
          "count": 1,
          "match": [
            { "path": "model", "equals": "claude-haiku-4-5" },
            { "path": "messages.0", "contains": "Reply with the single word PONG." },
            { "header": "x-api-key", "equals": "sk-ant-mock" }
          ]
        }
      },
      "live": { "expect": { "status": "success", "final_text_contains": "PONG" } }
    },
    {
      "id": "anthropic.thinking",
      "provider": "anthropic",
      "options": { "model": "claude-haiku-4-5" },
      "prompt": "Say ok.",
      "mock": [{ "thinking": "plan", "text": "ok", "usage": [10, 2] }],
      "expect": { "status": "success", "final_text": "ok", "events": { "includes": ["thinking", "text", "usage"] } }
    },
    {
      "id": "anthropic.effort",
      "provider": "anthropic",
      "options": { "model": "claude-sonnet-4-6", "effort": "low" },
      "prompt": "Say ok.",
      "mock": [{ "text": "ok" }],
      "expect": {
        "status": "success",
        "requests": { "match": [{ "path": "output_config.effort", "equals": "low" }] }
      },
      "live": { "expect": { "status": "success" } }
    },
    {
      "id": "anthropic.effort_unsupported",
      "provider": "anthropic",
      "options": { "model": "claude-haiku-4-5", "effort": "minimal" },
      "prompt": "Say ok.",
      "expect": { "config_error": true }
    },
    {
      "id": "anthropic.system_prompt",
      "provider": "anthropic",
      "options": {
        "model": "claude-haiku-4-5",
        "system_prompt": "When asked for the code word, reply with only MAPLE7."
      },
      "prompt": "What is the code word?",
      "mock": [{ "text": "MAPLE7" }],
      "expect": {
        "status": "success",
        "requests": { "match": [{ "path": "system", "contains": "When asked for the code word, reply with only MAPLE7." }] }
      },
      "live": { "expect": { "status": "success", "final_text_contains": "MAPLE7" } }
    },
    {
      "id": "anthropic.run_overrides",
      "provider": "anthropic",
      "options": { "model": "claude-haiku-4-5", "system_prompt": "AGENT-DEFAULT-PROMPT" },
      "run_options": { "system_prompt": "RUN-OVERRIDE-PROMPT", "model": "claude-sonnet-4-6" },
      "prompt": "Say ok.",
      "mock": [{ "text": "ok" }],
      "expect": {
        "status": "success",
        "requests": {
          "match": [
            { "path": "system", "contains": "RUN-OVERRIDE-PROMPT" },
            { "path": "system", "excludes": "AGENT-DEFAULT-PROMPT" },
            { "path": "model", "equals": "claude-sonnet-4-6" }
          ]
        }
      }
    },
    {
      "id": "anthropic.run_override_unknown",
      "provider": "anthropic",
      "languages": { "typescript": "unsupported: TypeScript accepts providerOptions per run, replacing the Agent's" },
      "options": { "model": "claude-haiku-4-5" },
      "run_options": { "provider_options": { "cli_path": "claude" } },
      "prompt": "Say ok.",
      "expect": { "config_error": true }
    },
    {
      "id": "anthropic.builtin_tools",
      "provider": "anthropic",
      "options": { "model": "claude-haiku-4-5", "builtin_tools": ["Read"] },
      "prompt": "Say ok.",
      "mock": [{ "text": "ok" }],
      "expect": {
        "status": "success",
        "requests": {
          "match": [
            { "request": 0, "path": "tools.0.name", "equals": "Read" },
            { "request": 0, "path": "tools.1", "absent": true }
          ]
        }
      }
    },
    {
      "id": "anthropic.builtin_tools_none",
      "provider": "anthropic",
      "options": { "model": "claude-haiku-4-5", "builtin_tools": "none" },
      "prompt": "Say ok.",
      "mock": [{ "text": "ok" }],
      "expect": { "status": "success", "requests": { "match": [{ "path": "tools.0", "absent": true }] } }
    },
    {
      "id": "anthropic.write_needs_approval",
      "provider": "anthropic",
      "options": { "model": "claude-haiku-4-5" },
      "prompt": "Create a file.",
      "mock": [{ "shell": "touch made-by-bash && echo CONF_TOUCHED" }, { "text": "done" }],
      "expect": { "status": "success", "tool_calls": ["Bash"], "tool_results": [{ "is_error": true }] }
    },
    {
      "id": "anthropic.allowed_tools",
      "provider": "anthropic",
      "options": { "model": "claude-haiku-4-5", "allowed_tools": ["Bash"] },
      "prompt": "Create a file.",
      "mock": [{ "shell": "touch made-by-bash && echo CONF_TOUCHED" }, { "text": "done" }],
      "expect": { "status": "success", "tool_results": [{ "contains": "CONF_TOUCHED" }] }
    },
    {
      "id": "anthropic.disallowed_tools",
      "provider": "anthropic",
      "options": { "model": "claude-haiku-4-5", "disallowed_tools": ["Bash"] },
      "prompt": "Say ok.",
      "mock": [{ "text": "ok" }],
      "expect": {
        "status": "success",
        "requests": {
          "match": [
            { "path": "tools", "contains": "\"name\":\"Read\"" },
            { "path": "tools", "excludes": "\"name\":\"Bash\"" }
          ]
        }
      }
    },
    {
      "id": "anthropic.web_tools_off",
      "provider": "anthropic",
      "languages": {
        "typescript": {
          "options": { "model": "claude-haiku-4-5", "disallowed_tools": ["WebSearch", "WebFetch"] },
          "reason": "TypeScript has no web_tools; callers disallow the web tools natively"
        }
      },
      "options": { "model": "claude-haiku-4-5", "web_tools": false },
      "prompt": "Search the web for today's top news headline. If you cannot search the web, reply exactly NO_WEB.",
      "mock": [{ "text": "NO_WEB" }],
      "expect": {
        "status": "success",
        "requests": {
          "match": [
            { "path": "tools", "contains": "\"name\":\"Read\"" },
            { "path": "tools", "excludes": "\"name\":\"WebSearch\"" },
            { "path": "tools", "excludes": "\"name\":\"WebFetch\"" }
          ]
        }
      },
      "live": { "expect": { "status": "success", "tool_calls": { "excludes": ["WebSearch", "WebFetch"] } } }
    },
    {
      "id": "anthropic.web_tools_on",
      "provider": "anthropic",
      "languages": { "typescript": "unsupported: TypeScript has no web_tools; anthropic.builtin_tools covers native tools lists" },
      "options": { "model": "claude-haiku-4-5", "web_tools": true, "builtin_tools": ["Read"] },
      "prompt": "Say ok.",
      "mock": [{ "text": "ok" }],
      "expect": {
        "status": "success",
        "requests": {
          "match": [
            { "path": "tools", "contains": "\"name\":\"WebSearch\"" },
            { "path": "tools", "contains": "\"name\":\"WebFetch\"" },
            { "path": "tools", "excludes": "\"name\":\"Bash\"" }
          ]
        }
      }
    },
    {
      "id": "anthropic.web_tools_conflict",
      "provider": "anthropic",
      "languages": { "typescript": "unsupported: TypeScript has no web_tools; a native tools list has no conflict to reject" },
      "options": { "model": "claude-haiku-4-5", "web_tools": true, "builtin_tools": "none" },
      "prompt": "Say ok.",
      "expect": { "config_error": true }
    },
    {
      "id": "anthropic.tools",
      "provider": "anthropic",
      "languages": { "typescript": { "expect": { "config_error": true }, "reason": "TypeScript does not implement callable tools yet" } },
      "options": { "model": "claude-haiku-4-5", "tools": ["add", "shout"] },
      "prompt": "Use the add tool to add 1234 and 4321, then use shout on the word maple. Reply with the sum.",
      "mock": [
        { "tool": { "name": "mcp__agent_sdk_wrapper_tools__add", "input": { "a": 1234, "b": 4321 } } },
        { "tool": { "name": "mcp__agent_sdk_wrapper_tools__shout", "input": { "text": "maple" } } },
        { "text": "5555 MAPLE" }
      ],
      "expect": {
        "status": "success",
        "tool_calls": ["mcp__agent_sdk_wrapper_tools__add", "mcp__agent_sdk_wrapper_tools__shout"],
        "tool_results": [{ "contains": "5555" }, { "contains": "MAPLE" }],